{
    "processing": {
        "batch_size": 2000,
        "buffer_size": 8000,
        "compression": "snappy",
        "parallel_workers": 8
    },
    "security": {
        "enable_encryption": true,
        "kms_key_id": "kms-arn-streaming-02"
    },
    "source": {
        "endpoint": "kafka-broker.internal:9092",
        "topic_or_bucket": "events.realtime.telemetry",
        "type": "kafka"
    },
    "system_protected": {
        "max_throughput_mb_s": 200,
        "pipeline_cluster_id": "ETL-STREAM-KAFKA-02"
    }
}